session_id,user_id,timestamp,return_user,day_of_week,time_of_day,session_duration_seconds,num_pages_viewed,num_items_carted,has_viewed_shipping_info,scroll_depth_percent,cart_value,discount_applied,discount_code,discount_percentage,shipping_fee,free_shipping_eligible,device_type,browser,referral_source,location,payment_page_reached,most_viewed_category,total_products_viewed,total_events,cart_items_count,cart_items_names,viewed_categories,current_page,engagement_score,abandoned
S1762445376,U4610,2025-11-06T21:39:52.674880,No,Thursday,Evening,16.3226,28,5,Yes,0.0,94502.95000000001,No,,0,0,Yes,Mobile,Edge,Ads,"Ludhiana, Punjab",Yes,Electronics,3,28,5,"Smartphone, Skincare Kit, Action Figure, Organic Snacks, Laptop","Toys, Groceries, Electronics, Beauty",home,8.4,No
S1762453441,U7047,2025-11-06T23:54:22.111627,No,Thursday,Night,60,31,4,Yes,35,10800.96,No,,0,0,Yes,Desktop,Edge,Search Engine,"Madurai, Tamil Nadu",No,Electronics,1,31,4,"Smartphone, Running Shoes, Wireless Earbuds, Coffee Beans","Groceries, Sports, Electronics",home,7.5,Yes
S1762455070,U7260,2025-11-07T00:21:38.296158,Yes,Friday,Night,60,27,5,Yes,0.0,18031.949999999997,No,,0,0,Yes,Tablet,Safari,Search Engine,"Kolkata, West Bengal",Yes,Sports,3,27,5,"Smartphone, Novel Collection, Running Shoes, Car Accessories, Running Shoes","Books, Electronics, Automotive, Sports",home,8.9,No
S1762456682,U7634,2025-11-07T00:48:36.616931,No,Friday,Night,60,23,4,Yes,35,4729.96,No,,0,0,Yes,Tablet,Firefox,Direct,"Jaipur, Rajasthan",Yes,Books,0,23,4,"Novel Collection, Backpack, Car Accessories, Power Bank","Accessories, Automotive, Books, Electronics",home,8.2,No
S1762456723,U8332,2025-11-07T00:53:02.876620,Yes,Friday,Night,259.479873,13,3,Yes,0.0,9600.97,No,,0,0,Yes,Desktop,Safari,Ads,"Siliguri, West Bengal",No,Sports,0,13,3,"Sunglasses, Running Shoes, Sports Socks","Accessories, Sports",home,6.5,Yes
S1762457309,U9331,2025-11-07T00:58:40.363489,No,Friday,Night,60,8,1,Yes,32,499.99,No,,0,0,Yes,Mobile,Opera,Direct,"Mangalore, Karnataka",No,Beauty,0,8,1,Skincare Kit,Beauty,home,5.64,Yes
S1762457309,U9331,2025-11-07T00:59:32.438631,No,Friday,Night,63.391995,20,3,Yes,32,2829.9700000000003,No,,0,0,Yes,Mobile,Opera,Direct,"Mangalore, Karnataka",Yes,Beauty,0,20,3,"Skincare Kit, Novel Collection, Sunglasses","Accessories, Beauty, Books",home,7.64,No
S1762457309,U9331,2025-11-07T01:00:04.475887,No,Friday,Night,95.429251,41,5,Yes,63,4829.95,No,,0,0,Yes,Mobile,Opera,Direct,"Mangalore, Karnataka",Yes,Beauty,1,41,5,"Skincare Kit, Novel Collection, Sunglasses, Cookware Set, Skincare Kit","Home & Kitchen, Accessories, Beauty, Books",home,9.059999999999999,No
